<!DOCTYPE Students SYSTEM "uni.dtd">
<Students>
    <Student RegistrationNumber="12345">
        <FirstName>Gouder</FirstName>
        <FamilyName>Hicham</FamilyName>
        <Age>21</Age>
        <Level>3</Level>
        <Speciality>Computer Science</Speciality>
        <Average>85.5</Average>
        <Address>
            <Number>123</Number>
            <City>El oued</City>
            <PostalCode>39000</PostalCode>
        </Address>
    </Student>
</Students>